{
  "eventId": "7c111111-1111-4111-8111-111111111111",
  "eventType": "evidence.correction-waived",
  "schemaVersion": 1,
  "tenantId": "tenant-byd",
  "correlationId": "corr-m51-waive",
  "causationId": "waive-1",
  "aggregateType": "CorrectionCase",
  "aggregateId": "7a222222-2222-4222-8222-222222222222",
  "aggregateVersion": 1,
  "occurredAt": "2026-07-14T16:20:00Z",
  "payload": {
    "correctionCaseId": "7a222222-2222-4222-8222-222222222222",
    "correctionTaskId": "7d444444-4444-4444-8444-444444444444",
    "taskId": "88888888-8888-4888-8888-888888888888",
    "projectId": "33333333-3333-4333-8333-333333333333",
    "waivedBy": "waiver-hq",
    "approvalRef": "APR-WAIVE-001",
    "reason": "现场条件永久不可复现，授权豁免补传",
    "waivedAt": "2026-07-14T16:20:00Z"
  }
}
